d o   y o u   p r e f e r   s  a   w i n d o w   s e a t,12.997167700000006
b e w a r e   t h e   i d e a s   o f   m   M a r c h            s   o g  f    M a r c h,33.94757379999999
 I   d o   n o t   f u l l y   a g r e e   w i t h   y o u,14.030873900000017
t h e   r e g i s t r a t i o n   p e r i o d   i s   o v e r,15.016611399999988
s i n g   g o s p e l   a n d   t h e   b l u e s                     t h e   g o s p e l   a n d   t h e   b l u e s,25.80199570000002
t h e   p u n i s h m e n t   s h o u l d   f i t   t h e   c r i m e,15.457000600000015
m y   f a v o r i t e   w e b   b r o w s e r,16.831811300000027
a   d o g   i s   t h e   b e s t   f r i e n d   o f   a   m a n,13.782317599999999
p a y   o f f   a   m o r t g a g e   f o r   a   h o u s e,12.843674000000021
s h a r p   c h e e s e   k e e p s   t h e   m i n d   s h a r p,16.230805199999963
