o  a n   o c c a s i o n a l   t a s t e   o f   c h o l  c o l a t e d ,8.268240500000047
a n   i n e f f i c i e n t   w a y   t o   h e a t   a   h o u s e,7.788503999999989
e l e c t r  i o n s   b r i i i   n g   o u t   t h e   b e s t,7.515166800000088
a   g o o d   s t i m u l u s   d e v e r s v      s e r v e s   a   g o o d   r e s p o n s e,10.111543299999994
a   p r o b l e m   w i t h   t h e   e n d i n g     g i n e,6.017622200000005
a r g u i n g   t  w i t h   t h e   b o s s   i s   f u t i l e,6.7063408999999865
t h e   s t o c k   e x c h a n g e   d  d i p p e d,6.397039899999982
o u r   h o u s e k e e p e r   d o e s   a   t h o r o u g h t    j o b,7.833252000000016
k n e e   b o n e   i s   c o n n e c t e d   t o   t h e   t i g   h i g h   b o n e,8.809284599999955
m y   c a r   a l w a y s   b r e a k s   i n   t h e   w i n t e r,6.295591400000035
